<!-- version="0.3.1-a" -->
<!ELEMENT Resource (Map)>

<!ATTLIST Resource
       type (aamap) "aamap" 
       name CDATA #REQUIRED
       version CDATA "1.0"
       author CDATA "Anonymous"
       category CDATA "unsorted"
       comissioner CDATA #IMPLIED
>

<!ELEMENT Map (Settings?, World)> 

<!ELEMENT Settings (Setting*)>
<!ELEMENT Setting EMPTY>
<!ATTLIST Setting name CDATA #REQUIRED>
<!ATTLIST Setting value CDATA #REQUIRED>

<!-- ATM, a map contain only one Field -->
<!ELEMENT World (Field)>
<!-- a field 
  - may have an axes declared
  - need at least one spawn
  - need at least one wall -->
<!ELEMENT Field (Axes?, (Spawn | Wall | Monitor | Zone )*)>

<!ELEMENT Axes (Axis*)>
<!ELEMENT Spawn EMPTY> 
<!ELEMENT Wall (Point+) >
<!ELEMENT Point EMPTY>
<!ELEMENT Axis EMPTY>
<!ELEMENT Zone (ShapeCircle, (Enter | Inside | Leave | Outside)+ ) >

<!ATTLIST Map version CDATA #REQUIRED>

<!ATTLIST Field logicalBox (true | false) "true">

<!ATTLIST Axes number CDATA "4">
<!ATTLIST Axes normalize (true | false) "true">

<!ATTLIST Spawn x CDATA #REQUIRED>
<!ATTLIST Spawn y CDATA #REQUIRED>
<!ATTLIST Spawn xdir CDATA #IMPLIED>
<!ATTLIST Spawn ydir CDATA #IMPLIED>
<!ATTLIST Spawn angle CDATA #IMPLIED>
<!ATTLIST Spawn length CDATA "1.0">

<!ATTLIST Wall height CDATA #IMPLIED>

<!ATTLIST Point x CDATA #REQUIRED>
<!ATTLIST Point y CDATA #REQUIRED>

<!ATTLIST Axis xdir CDATA #IMPLIED>
<!ATTLIST Axis ydir CDATA #IMPLIED>
<!ATTLIST Axis angle CDATA #IMPLIED>
<!ATTLIST Axis length CDATA "1.0">


<!ATTLIST Zone name CDATA "">

<!ELEMENT Monitor (OnOver | OnUnder | InRange | OutsideRange)+ >
<!ATTLIST Monitor name  CDATA #REQUIRED>
<!ATTLIST Monitor init  CDATA "0.0">
<!ATTLIST Monitor drift CDATA "0.0">
<!ATTLIST Monitor low   CDATA "0.0">
<!ATTLIST Monitor high  CDATA "1.0">

<!ELEMENT OnOver (EffectGroup+) >
<!ATTLIST OnOver value  CDATA #REQUIRED>

<!ELEMENT OnUnder (EffectGroup+) >
<!ATTLIST OnUnder value CDATA #REQUIRED>

<!ELEMENT InRange (EffectGroup+) >
<!ATTLIST InRange low   CDATA #REQUIRED>
<!ATTLIST InRange high  CDATA #REQUIRED>

<!ELEMENT OutsideRange (EffectGroup+) >
<!ATTLIST OutsideRange low  CDATA #REQUIRED>
<!ATTLIST OutsideRange high CDATA #REQUIRED>


<!ELEMENT ShapeCircle (Point, Color)>
<!ATTLIST ShapeCircle radius CDATA #REQUIRED>
<!ATTLIST ShapeCircle growth CDATA "0.0">

<!ELEMENT Color EMPTY>
<!ATTLIST Color red   CDATA "1.0">
<!ATTLIST Color green CDATA "0.0">
<!ATTLIST Color blue  CDATA "0.0">
<!ATTLIST Color alpha  CDATA "0.0">

<!ELEMENT Enter   (EffectGroup+) >
<!ELEMENT Inside  (EffectGroup+) >
<!ELEMENT Leave   (EffectGroup+) >
<!ELEMENT Outside (EffectGroup+) >

<!ELEMENT EffectGroup (User)>
<!ATTLIST EffectGroup owners CDATA #IMPLIED>
<!ATTLIST EffectGroup teamOwners CDATA #IMPLIED>

<!ELEMENT User (Target | MonitorInfluence | ZoneInfluence)+ >
<!ATTLIST User user (all | owner | ownerTeam | allButOwner | allButTeamOwner | anotherTeammate) "all" >
<!ATTLIST User positive (true | false | ignore) "ignore" >
<!ATTLIST User marked   (true | false | ignore) "ignore" >


<!ELEMENT Target (Effect)+ >
<!ATTLIST Target target (self | teammate | team | all | allButSelf |
 another | 
owner | ownerTeam | ownerTeamTeammate | anyDead |
allDead | anotherTeammateDead | anotherNotTeammateDead |
singleDeadOwner
) "self" >
<!-- 
<!ATTLIST Target target (self | teammate | team | all | allButSelf |
allButTeam | another | anotherTeam | anotherTeammate |
anotherNotTeammate | owner | ownerTeam | ownerTeamTeammate | anyDead |
allDead | AnotherTeammateDead | anotherNotTeammateDead) "self" >
-->
<!ATTLIST Target count CDATA "-1">


<!ELEMENT Effect EMPTY>
<!ATTLIST Effect effect (win | death | point | brakerecharge |
rubberrecharge | spawnplayer | setting ) "death" >
<!ATTLIST Effect count CDATA "-1">
<!ATTLIST Effect description CDATA #IMPLIED>
<!ATTLIST Effect score CDATA "1"> <!-- only for point -->
<!ATTLIST Effect settingName CDATA #IMPLIED> <!-- only for setting -->
<!ATTLIST Effect settingValue CDATA #IMPLIED><!-- only for setting -->


<!ELEMENT MonitorInfluence EMPTY>
<!ATTLIST MonitorInfluence name CDATA #IMPLIED>
<!ATTLIST MonitorInfluence marked (true | false | ignore) "ignore">
<!ATTLIST MonitorInfluence influenceSlide CDATA #IMPLIED>
<!ATTLIST MonitorInfluence influenceAdd   CDATA #IMPLIED>
<!ATTLIST MonitorInfluence influenceSet   CDATA #IMPLIED>


<!ELEMENT ZoneInfluence (Rotation | Radius | Point | Color)+ >
<!ATTLIST ZoneInfluence name CDATA #IMPLIED>

<!ELEMENT Rotation EMPTY>
<!ATTLIST Rotation rotationSpeed CDATA "0.0">
<!ATTLIST Rotation rotationAcceleration CDATA "0.0">

<!ELEMENT Radius EMPTY>
<!ATTLIST Radius radius CDATA "1.0">




