<?xml version="1.0" encoding="UTF-8" standalone="no"?>
<!DOCTYPE Resource SYSTEM "map-0.3.1-a.dtd">
<Resource type="aamap" name="spinning_square" version="0.0.2" author="Anonymous" category="polygon/regular">
	<Map version="2">
		<World>
			<Field>
				<Spawn	x="255"	y="50"	xdir="0"	ydir="1"	/>
				<Spawn	x="245"	y="450"	xdir="0"	ydir="-1"	/>
				<Spawn	x="50"	y="245"	xdir="1"	ydir="0"	/>
				<Spawn	x="450"	y="255"	xdir="-1"	ydir="0"	/>

				<Spawn	x="305"	y="100"	xdir="0"	ydir="1"	/>
				<Spawn	x="195"	y="400"	xdir="0"	ydir="-1"	/>
				<Spawn	x="100"	y="195"	xdir="1"	ydir="0"	/>
				<Spawn	x="400"	y="305"	xdir="-1"	ydir="0"	/>

				<Spawn	x="205"	y="100"	xdir="0"	ydir="1"	/>
				<Spawn	x="295"	y="400"	xdir="0"	ydir="-1"	/>
				<Spawn	x="100"	y="295"	xdir="1"	ydir="0"	/>
				<Spawn	x="400"	y="205"	xdir="-1"	ydir="0"	/>
				
				<Wall height="0.01">
						<Point x="-104" y="-104" />
						<Point x="-104"  y="604" />
						<Point  x="604"  y="604" />
						<Point  x="604" y="-104" />
						<Point x="-104" y="-104" />
				</Wall>
				
				<Zone>
					<ShapePolygon rotation="0;.05">
						<!-- Origin point -->
						<Point  x="250" y="250" />
						<Color red="1" green=".7" blue=".7" />
						<!-- Shape -->
						<Point x="-250" y="-250" />
						<Point x="-250"  y="250" />
						<Point  x="250"  y="250" />
						<Point  x="250" y="-250" />
						<Point x="-250" y="-250" />
					</ShapePolygon>
					<Leave>
						<EffectGroup>
							<User>
								<Target>
									<Effect effect="death" />
								</Target>
							</User>
						</EffectGroup>
					</Leave>
				</Zone>
			</Field>
		</World>
	</Map>
</Resource>
